[
  {
    "service_id": "svc-001",
    "service_name": "mariner-edge-gateway",
    "waiver_id": null,
    "waiver_type": "none",
    "status": "none",
    "scope": null,
    "granted_on": null,
    "expires_on": null,
    "revoked_on": null
  },
  {
    "service_id": "svc-002",
    "service_name": "mariner-auth-broker",
    "waiver_id": "WV-2026-002",
    "waiver_type": "tls",
    "status": "granted",
    "scope": "all",
    "granted_on": "2026-02-01",
    "expires_on": "2026-12-01",
    "revoked_on": null
  },
  {
    "service_id": "svc-003",
    "service_name": "mariner-billing-api",
    "waiver_id": "WV-2026-003",
    "waiver_type": "tls",
    "status": "granted",
    "scope": "all",
    "granted_on": "2026-01-15",
    "expires_on": "2026-05-01",
    "revoked_on": null
  },
  {
    "service_id": "svc-004",
    "service_name": "mariner-fulfillment",
    "waiver_id": "WV-2026-004",
    "waiver_type": "mtls",
    "status": "granted",
    "scope": "prod",
    "granted_on": "2026-01-20",
    "expires_on": "2026-04-30",
    "revoked_on": null
  },
  {
    "service_id": "svc-005",
    "service_name": "mariner-telemetry",
    "waiver_id": "WV-2026-005",
    "waiver_type": "chain",
    "status": "revoked",
    "scope": "all",
    "granted_on": "2026-02-10",
    "expires_on": "2026-09-01",
    "revoked_on": "2026-04-15"
  },
  {
    "service_id": "svc-006",
    "service_name": "mariner-config-service",
    "waiver_id": "WV-2026-006",
    "waiver_type": "tls",
    "status": "revoked",
    "scope": "all",
    "granted_on": "2026-01-05",
    "expires_on": "2026-08-01",
    "revoked_on": "2026-03-20"
  },
  {
    "service_id": "svc-007",
    "service_name": "mariner-search-index",
    "waiver_id": null,
    "waiver_type": "none",
    "status": "none",
    "scope": null,
    "granted_on": null,
    "expires_on": null,
    "revoked_on": null
  },
  {
    "service_id": "svc-008",
    "service_name": "mariner-dev-sandbox",
    "waiver_id": null,
    "waiver_type": "none",
    "status": "none",
    "scope": null,
    "granted_on": null,
    "expires_on": null,
    "revoked_on": null
  },
  {
    "service_id": "svc-009",
    "service_name": "mariner-payments-gw",
    "waiver_id": null,
    "waiver_type": "none",
    "status": "none",
    "scope": null,
    "granted_on": null,
    "expires_on": null,
    "revoked_on": null
  },
  {
    "service_id": "svc-010",
    "service_name": "mariner-partner-api",
    "waiver_id": "WV-2026-010",
    "waiver_type": "mtls",
    "status": "granted",
    "scope": "staging",
    "granted_on": "2026-02-01",
    "expires_on": "2026-09-01",
    "revoked_on": null
  },
  {
    "service_id": "svc-011",
    "service_name": "mariner-audit-log",
    "waiver_id": null,
    "waiver_type": "none",
    "status": "none",
    "scope": null,
    "granted_on": null,
    "expires_on": null,
    "revoked_on": null
  },
  {
    "service_id": "svc-012",
    "service_name": "mariner-notifications",
    "waiver_id": null,
    "waiver_type": "none",
    "status": "none",
    "scope": null,
    "granted_on": null,
    "expires_on": null,
    "revoked_on": null
  },
  {
    "service_id": "svc-013",
    "service_name": "mariner-staging-portal",
    "waiver_id": null,
    "waiver_type": "none",
    "status": "none",
    "scope": null,
    "granted_on": null,
    "expires_on": null,
    "revoked_on": null
  },
  {
    "service_id": "svc-014",
    "service_name": "mariner-reporting",
    "waiver_id": null,
    "waiver_type": "none",
    "status": "none",
    "scope": null,
    "granted_on": null,
    "expires_on": null,
    "revoked_on": null
  },
  {
    "service_id": "svc-015",
    "service_name": "mariner-legacy-soap",
    "waiver_id": null,
    "waiver_type": "none",
    "status": "none",
    "scope": null,
    "granted_on": null,
    "expires_on": null,
    "revoked_on": null
  },
  {
    "service_id": "svc-016",
    "service_name": "mariner-iot-bridge",
    "waiver_id": null,
    "waiver_type": "none",
    "status": "none",
    "scope": null,
    "granted_on": null,
    "expires_on": null,
    "revoked_on": null
  },
  {
    "service_id": "svc-017",
    "service_name": "mariner-cdn-origin",
    "waiver_id": null,
    "waiver_type": "none",
    "status": "none",
    "scope": null,
    "granted_on": null,
    "expires_on": null,
    "revoked_on": null
  },
  {
    "service_id": "svc-018",
    "service_name": "mariner-docs-site",
    "waiver_id": null,
    "waiver_type": "none",
    "status": "none",
    "scope": null,
    "granted_on": null,
    "expires_on": null,
    "revoked_on": null
  },
  {
    "service_id": "svc-019",
    "service_name": "mariner-grpc-mesh",
    "waiver_id": "WV-2026-019",
    "waiver_type": "tls",
    "status": "granted",
    "scope": "all",
    "granted_on": "2026-03-01",
    "expires_on": "2026-07-10",
    "revoked_on": null
  },
  {
    "service_id": "svc-020",
    "service_name": "mariner-webhook-relay",
    "waiver_id": "WV-2026-020",
    "waiver_type": "mtls",
    "status": "granted",
    "scope": "prod",
    "granted_on": "2026-03-10",
    "expires_on": "2026-07-05",
    "revoked_on": null
  },
  {
    "service_id": "svc-021",
    "service_name": "mariner-ml-gateway",
    "waiver_id": "WV-2026-021",
    "waiver_type": "tls",
    "status": "granted",
    "scope": "all",
    "granted_on": "2026-02-15",
    "expires_on": "2026-12-15",
    "revoked_on": null
  },
  {
    "service_id": "svc-022",
    "service_name": "mariner-vault-proxy",
    "waiver_id": "WV-2026-022",
    "waiver_type": "mtls",
    "status": "granted",
    "scope": "prod",
    "granted_on": "2026-01-10",
    "expires_on": "2026-11-01",
    "revoked_on": null
  },
  {
    "service_id": "svc-023",
    "service_name": "mariner-status-page",
    "waiver_id": null,
    "waiver_type": "none",
    "status": "none",
    "scope": null,
    "granted_on": null,
    "expires_on": null,
    "revoked_on": null
  },
  {
    "service_id": "svc-024",
    "service_name": "mariner-feature-flags",
    "waiver_id": null,
    "waiver_type": "none",
    "status": "none",
    "scope": null,
    "granted_on": null,
    "expires_on": null,
    "revoked_on": null
  },
  {
    "service_id": "svc-025",
    "service_name": "mariner-batch-scheduler",
    "waiver_id": "WV-2026-025",
    "waiver_type": "tls",
    "status": "granted",
    "scope": "all",
    "granted_on": "2026-03-05",
    "expires_on": "2026-07-12",
    "revoked_on": null
  },
  {
    "service_id": "svc-026",
    "service_name": "mariner-export-gateway",
    "waiver_id": "WV-2026-026",
    "waiver_type": "mtls",
    "status": "granted",
    "scope": "prod",
    "granted_on": "2026-02-20",
    "expires_on": "2026-07-08",
    "revoked_on": null
  },
  {
    "service_id": "svc-027",
    "service_name": "mariner-archive-store",
    "waiver_id": "WV-2026-027",
    "waiver_type": "tls",
    "status": "granted",
    "scope": "all",
    "granted_on": "2026-03-15",
    "expires_on": "2026-07-05",
    "revoked_on": null
  },
  {
    "service_id": "svc-028",
    "service_name": "mariner-quota-service",
    "waiver_id": "WV-2026-028",
    "waiver_type": "mtls",
    "status": "granted",
    "scope": "all",
    "granted_on": "2026-02-01",
    "expires_on": "2026-12-01",
    "revoked_on": null
  },
  {
    "service_id": "svc-029",
    "service_name": "mariner-rate-limiter",
    "waiver_id": "WV-2026-029",
    "waiver_type": "tls",
    "status": "granted",
    "scope": "staging",
    "granted_on": "2026-02-01",
    "expires_on": "2026-12-01",
    "revoked_on": null
  },
  {
    "service_id": "svc-030",
    "service_name": "mariner-session-store",
    "waiver_id": "WV-2026-030",
    "waiver_type": "tls",
    "status": "granted",
    "scope": "all",
    "granted_on": "2026-01-01",
    "expires_on": "2026-12-20",
    "revoked_on": null
  },
  {
    "service_id": "svc-031",
    "service_name": "mariner-pref-service",
    "waiver_id": "WV-2026-031",
    "waiver_type": "tls",
    "status": "granted",
    "scope": "all",
    "granted_on": "2026-02-01",
    "expires_on": "2026-06-25",
    "revoked_on": null
  },
  {
    "service_id": "svc-032",
    "service_name": "mariner-trace-collector",
    "waiver_id": "WV-2026-032",
    "waiver_type": "chain",
    "status": "granted",
    "scope": "all",
    "granted_on": "2026-03-01",
    "expires_on": "2026-07-05",
    "revoked_on": null
  },
  {
    "service_id": "svc-033",
    "service_name": "mariner-preview-portal",
    "waiver_id": "WV-2026-033",
    "waiver_type": "tls",
    "status": "granted",
    "scope": "all",
    "granted_on": "2026-01-15",
    "expires_on": "2026-12-15",
    "revoked_on": null
  }
]
